{"branches":[],"diagnostics":[{"code":"Y0101","parameters":{"node_type":"MISSING:}"},"path":"experiments/language-spike/fixtures/sources/P03.yh","severity":"error","span":{"end":17,"end_col":18,"end_line":1,"start":17,"start_col":18,"start_line":1},"stage":"parse"}],"fragment":"ClosedBooleanBranches-v1","input_digest":"977a41ee7c659aaae907a6cfce74b90950f4bb4f540322d31cea675d3469de79","protocol":"yuho.kernel-protocol/v1","provision_kind":"none","request_id":"P03","result_schema":"yuho.kernel-result/v1","status":"rejected","trace":[]}
