{"branches":[],"diagnostics":[],"fragment":"ClosedBooleanBranches-v1","input_digest":"b291ade2701327e370bfb003d69872ee6b7de8352ae7b99c7abfd5dc11d12d19","protocol":"yuho.kernel-protocol/v1","provision_kind":"definition_only","request_id":"B05","result_schema":"yuho.kernel-result/v1","status":"false","trace":[]}
