{"branches":[{"id":"s1(a)","path":["1","(a)"],"status":"false","trace_ids":["first"]},{"id":"s1(b)","path":["1","(b)"],"status":"false","trace_ids":["second"]}],"diagnostics":[],"fragment":"ClosedBooleanBranches-v1","input_digest":"2ebce5f218fbc3297c292ad6a6bf48313a34a6bd891dd9e5ac8cb7147be24145","protocol":"yuho.kernel-protocol/v1","provision_kind":"executable","request_id":"B02","result_schema":"yuho.kernel-result/v1","status":"false","trace":[{"branch":"s1(a)","children":[],"id":"first","kind":"leaf","path":["1","(a)"],"span":{"end":104,"end_col":69,"end_line":3,"start":76,"start_col":41,"start_line":3},"value":"false"},{"branch":"s1(b)","children":[],"id":"second","kind":"leaf","path":["1","(b)"],"span":{"end":179,"end_col":71,"end_line":4,"start":149,"start_col":41,"start_line":4},"value":"false"}]}
